Name,Type,Location,Frequency,Address,Latitude,Longitude,Phone,Website,Email,Notes
Port Royal Farmers Market,Market,Port Royal,weekly,"Naval Heritage Park, 1615 Ribaut Road",32.3833,-80.6956,843-470-0699,https://portroyalfarmersmarket.com,kitbruce1111@gmail.com,Year-round Saturday farmers market serving Port Royal and Beaufort
Visit Beaufort Events Calendar,Events,Beaufort County,ongoing,,,,,https://www.beaufortsc.org/events,,major local events
City of Beaufort Calendar,Civic,Beaufort,ongoing,,,,,https://www.cityofbeaufort.org,,city meetings and events
Town of Port Royal Calendar,Civic,Port Royal,ongoing,,,,,https://www.portroyal.org/calendar,,local events and announcements
Historic Port Royal Foundation,Events,Port Royal,monthly,,,,,https://historicportroyalfoundation.com,,Third Thursday and community events
Beaufort County Library,Education,Beaufort County,weekly,,,,,https://www.beaufortcountylibrary.org,,story hours and classes
Spanish Moss Trail,Activity,Beaufort/Port Royal,ongoing,,,,,https://spanishmosstrail.com,,community walks and cycling
Pat Conroy Literary Center,Culture,Beaufort,monthly,,,,,https://patconroyliterarycenter.org,,readings and literary events
USCB Events Calendar,Education,Beaufort,weekly,,,,,https://www.uscb.edu,,university lectures and events
Beaufort County Parks & Recreation,Outdoors,Beaufort County,weekly,,,,,https://bcgov.net/parks-and-recreation,,youth and adult recreation programs
Downtown Beaufort Farmers’ Market,Market,Beaufort,weekly,North & Bladen Streets,32.4308643,-80.6735035,843-525-7070,https://www.cityofbeaufort.org,,City-run downtown farmers market with produce and food trucks
Farmers’ Market of Bluffton,Market,Bluffton,weekly,"Carson Cottages, 40 Calhoun St.",32.240246,-80.859421,843-415-2447,https://farmersmarketbluffton.org,,Thursday afternoon market with local farms and artisans
U Pick Daffodils,Activity,Okatie,seasonal,48 Calhoun Plantation Road,32.3,-80.9,843-368-1998,https://www.upickdaffodils.com,,U-pick daffodil farm open in late winter/early spring
Helena Hills Farm,Activity,Hardeeville,seasonal,577 Bellinger Hill Run Road,32.2843,-81.076998,646-656-1506,https://www.helenahillsfarm.com,,U-pick flower farm with events and workshops
"Marshview Farm, LLC",Activity,St. Helena Island,seasonal,1257 Seaside Road,32.412557,-80.476554,843-838-4829,,Marshview1012@embarqmail.com,Sustainable farm with fruit and vegetable production; offers farm tours
Barefoot Farms,Activity,St. Helena Island,seasonal,939 Sea Island Pkwy,32.412557,-80.476554,843-838-7421,,,U-pick strawberries and seasonal produce
Dempsey Farms U-Pick,Activity,St. Helena Island,seasonal,1576 Sea Island Pkwy,32.412557,-80.476554,843-838-3656,,,Family-owned U-pick farm with seasonal vegetables and berries
Port Royal Sound Foundation Maritime Center,Family Nature Center,"Okatie, SC",ongoing,"310 Okatie Highway, Okatie, SC 29909",,,843-645-7774,https://portroyalsoundfoundation.org/visit-the-maritime-center/,,Free maritime and estuary center with live animals exhibits and hands-on learning for all ages.
Kazoo Factory Museum,Factory Tour,"Beaufort, SC",ongoing,"12 John Galt Road, Beaufort, SC 29906",,,843-982-6387,https://kazoofactorymuseum.com/,,Kid-friendly factory tour where visitors see how kazoos are made and make one to take home.
Naval Heritage Park,Playground Park,"Port Royal, SC",ongoing,"1600 Ribaut Road, Port Royal, SC 29935",,,843-986-2200,https://www.portroyal.org/251/Naval-Heritage-Park,,Shaded community park with the Spanish Galleon playground skate park trail and picnic spots.
Henry C. Chambers Waterfront Park Playground,Playground Park,"Beaufort, SC",ongoing,"103 Charles Street, Beaufort, SC 29902",,,,https://www.nps.gov/places/henry-c-chambers-waterfront-park.htm,,Downtown waterfront playground with climbing features swings open space and river views.
The Sandbox Children's Museum,Children's Museum,"Hilton Head Island, SC",ongoing,"80 Nassau Street, Hilton Head Island, SC 29928",,,843-842-7645,https://thesandbox.org/,,Interactive children's museum focused on hands-on play exhibits programs camps and creative learning.
Coastal Discovery Museum Kids' Zone,Family Nature Center,"Hilton Head Island, SC",ongoing,"70 Honey Horn Drive, Hilton Head Island, SC 29926",,,843-689-6767,https://www.coastaldiscovery.org/explore/exhibits/kids-zone/,,Discovery House kids zone with books puzzles puppets and live Lowcountry animals plus family-friendly grounds.
Savannah Children's Museum,Children's Museum,"Savannah, GA",ongoing,"655 Louisville Road, Savannah, GA 31401",,,912-651-4292,https://chsgeorgia.org/savannah-childrens-museum/,,Outdoor exploration museum with imaginative play spaces plus the indoor STEAM Center and mirror maze.
Hunting Island Lighthouse,Lighthouse Adventure,"Hunting Island, SC",ongoing,"2555 Sea Island Parkway, Hunting Island, SC 29920",,,843-838-4868,https://www.friendsofhuntingisland.org/reservations,,Family outing spot at Hunting Island where visitors can reserve lighthouse climbs and enjoy beach and nature day trips.
Pinckney Island National Wildlife Refuge,Wildlife Refuge,"Hilton Head Island / Bluffton, SC",ongoing,"4 Howard Drive, Hilton Head Island, SC 29926",,,843-784-2468,https://www.fws.gov/refuge/pinckney-island,savannahcoastal@fws.gov,National wildlife refuge with hiking biking birding wildlife watching and photography on more than 14 miles of trails.
Ernest F. Hollings ACE Basin National Wildlife Refuge,Wildlife Refuge,"Green Pond, SC",ongoing,"8675 Willtown Road, Green Pond, SC 29446",,,843-889-3084,https://www.fws.gov/refuge/ernest-f-hollings-ace-basin,acebasin@fws.gov,Large coastal refuge with hiking birding wildlife viewing photography and historic plantation landscapes in the ACE Basin.
Hunting Island State Park,State Park,"Hunting Island, SC",ongoing,"2555 Sea Island Parkway, Hunting Island, SC 29920",,,843-838-2011,https://southcarolinaparks.com/hunting-island,,South Carolina's most visited state park with beaches marsh boardwalks trails a lighthouse nature programs and camping.
Edisto Beach State Park,State Park,"Edisto Island, SC",ongoing,"8377 State Cabin Road, Edisto Island, SC 29438",,,843-869-4430,https://southcarolinaparks.com/edisto-beach,,Oceanfront state park with beach access trails an environmental learning center ranger programs and broad wildlife habitat.
Cypress Wetlands,Wetlands Park,"Port Royal, SC",ongoing,"1700 Paris Avenue, Port Royal, SC 29935",,,843-986-2200,https://www.portroyal.org/250/Cypress-Wetlands-Rookery-and-Amphitheate,,Port Royal birdwatching wetland with walking trails rookery views migratory birds and regular alligator turtle and waterfowl sightings.
Crystal Lake Park,Nature Preserve,"Lady's Island, SC",ongoing,"124 Lady's Island Drive, Beaufort, SC 29907",,,,,https://www.beaufortcountysc.gov/events/2025/03/03.15.2025%20Birding%20at%20Crystal%20Lake%20Park.html,,County passive park with a half-mile loop trail boardwalk fishing pier and strong wildlife-viewing and birding habitat around the lake.
Widgeon Point Preserve,Nature Preserve,"Okatie, SC",ongoing,"43 Okatie Highway, Beaufort, SC 29909",,,,,https://www.beaufortcountysc.gov/events/2025/03/03.19.2025%20Birding%20at%20Widgeon%20Point.html,,Scenic preserve with a loop trail bird blind marsh views picnic pavilion and excellent birding and walking along the Broad River.
Port Royal Museum,History Museum,"Port Royal, SC",ongoing,"1634 Paris Avenue, Port Royal, SC 29935",,,843-524-4333,https://www.portroyalhistory.org/,,Local history museum covering Port Royal railroad shrimping fishing crabbing and the town's deep-water port heritage.
Beaufort History Museum,History Museum,"Beaufort, SC",ongoing,"713 Craven Street, Beaufort, SC 29902",,,843-379-3079,https://beauforthistorymuseum.wildapricot.org/about-us/,,History museum in the Beaufort Arsenal interpreting the Beaufort District from Native settlement through the Civil War and modern era.
Parris Island Museum,History Museum,"Parris Island, SC",ongoing,"676 Panama Street, Parris Island, SC 29905",,,843-228-2951,https://parrisislandfoundation.org/museum,PImuseum@usmc.mil,Public museum on Parris Island featuring Marine Corps history plus Port Royal area and early colonial island history.
Savannah History Museum,History Museum,"Savannah, GA",ongoing,"303 Martin Luther King Jr. Boulevard, Savannah, GA 31401",,,912-651-6825,https://exploregeorgia.org/savannah/arts-culture/museums/savannah-history-museum,,Regional history museum inside Savannah's former rail station with exhibits spanning colonial through twentieth-century city history.
Highway 21 Drive In Theater,Movie Theater,"Beaufort, SC",ongoing,"55 Parker Drive, Beaufort, SC 29906",,,,,https://hwy21drivein.com/,,Classic drive-in movie theater with weekend double features on three screens plus concessions and a flea market.
Cinemark Bluffton,Movie Theater,"Bluffton, SC",ongoing,"106 Buckwalter Parkway, Bluffton, SC 29910",,,843-757-2859,https://www.cinemark.com/theatres/sc-bluffton/cinemark-bluffton,,Multiplex movie theater in Bluffton with current releases reserved seating concessions and luxury lounger-style cinema amenities.
Coligny Theatre,Movie Theater,"Hilton Head Island, SC",ongoing,"1 North Forest Beach Drive, Hilton Head Island, SC 29928",,,843-686-3500,https://colignytheatre.com/,,Hilton Head's longtime movie theater and event venue known for films specialty screenings and community performances in Coligny Plaza.
Beaufort Dolphin Adventures,Boat Tour,"Port Royal, SC",ongoing,"1 Port Royal Landing Drive, Port Royal, SC 29935",,,843-259-2581,https://www.beaufortdolphinadventures.com/,info@beaufortdolphinadventures.com,Private Beaufort and Port Royal boat tours focused on dolphins wildlife sunset cruises and scenic Lowcountry waterways.
Coastal Expeditions Beaufort,Boat Tour,"Beaufort, SC",ongoing,"1006 Bay Street, Beaufort, SC 29902",,,,,https://coastalexpeditions.com/beaufort/,,Naturalist-led Beaufort boat tours and coastal trips including dolphin cruises sunset outings and barrier island adventures.
Beaufort Kayak Tours,Kayak Tour,"Beaufort, SC",ongoing,,,,843-525-0810,https://beaufortkayaktours.com/,info@beaufortkayaktours.com,Owner-led guided kayak tours around Beaufort focused on marsh ecology dolphins oysters local history and seasonal tide-based paddling.
Coastal Expeditions St. Helena Outpost,Kayak Tour,"St. Helena Island, SC",ongoing,"1928 Sea Island Parkway, St. Helena Island, SC 29920",,,,,https://coastalexpeditions.com/beaufort/,,Kayak tours and rentals from the St. Helena outpost with marsh paddles wildlife viewing and family-friendly guided outings near Hunting Island.
