Name,Tags,StartDate,EndDate,StartTime,EndTime,AllDay,Location,Address,Website,Source,Notes
Coffee & Camaraderie OPFOB on the Road - Beaufort,Civic,2026-03-07,2026-03-07,09:00,,,Port Royal,Live Oaks Park,https://www.portroyal.org/calendar.aspx?EID=1042&PREVIEW=YES,Town of Port Royal,Community coffee gathering in Port Royal.
2026 FFF Oyster Roast,Culture,2026-03-13,2026-03-13,17:00,20:00,,"Port Royal, SC",Live Oaks Park,https://www.beaufortsc.org/,Visit Beaufort,Annual Friends of Fort Fremont oyster roast in Port Royal.
Radiance Run 5K,Sports,2026-03-14,2026-03-14,,,,Port Royal,Port Royal,https://www.portroyal.org/,Town of Port Royal,Community 5K supporting Radiance Pregnancy Care Center.
St. Patrick's Party,Sports,2026-03-16,2026-03-16,19:00,,,Savannah,"Enmarket Arena, 620 Stiles Avenue, Savannah, GA 31415",https://ghostpirateshockey.com/games/2026/03/16/st-patricks-party,Savannah Ghost Pirates,Home Ghost Pirates game against Toledo with a St. Patrick's themed promotion at Enmarket Arena.
Third Thursday - Historic Port Royal Foundation,Culture,2026-03-19,2026-03-19,17:00,20:00,,"Port Royal, SC","1634 Paris Avenue, Port Royal, SC 29935",https://www.portroyal.org/,Town of Port Royal,Historic Port Royal Foundation monthly evening community event.
Galactic Bowling,Sports,2026-03-19,2026-03-19,20:00,,,Bluffton,"Station 300 Bluffton, 25 Innovation Drive, Bluffton, SC 29910",https://station300bluffton-temp2.bowlrx.com/specials/galactic-bowling/,Station 300 Bluffton,Thursday night galactic bowling with $2 games and $2 shoe rental.
4th Annual Spring Symposium Opening Reception,Education,2026-03-20,2026-03-20,18:00,20:00,,Beaufort,"USCB Center for the Arts, 805 Carteret Street, Beaufort, SC 29902",https://www.uscb.edu/academics/humanities-social-sciences/history/isre/symposium/index.html,USCB,Opening reception for the 2026 ISRE Spring Symposium.
Greenville Swamp Rabbits @ Savannah Ghost Pirates,Sports,2026-03-20,2026-03-20,19:00,,,Savannah,"Enmarket Arena, 620 Stiles Avenue, Savannah, GA 31415",https://ghostpirateshockey.com/,Savannah Ghost Pirates,Home Ghost Pirates game against Greenville at Enmarket Arena.
Galactic Bowling,Sports,2026-03-20,2026-03-20,20:00,,,Bluffton,"Station 300 Bluffton, 25 Innovation Drive, Bluffton, SC 29910",https://station300bluffton-temp2.bowlrx.com/specials/galactic-bowling/,Station 300 Bluffton,Friday night galactic bowling at Station 300.
4th Annual Spring Symposium,Education,2026-03-21,2026-03-21,09:00,15:00,,Beaufort,"USCB Center for the Arts, 805 Carteret Street, Beaufort, SC 29902",https://www.uscb.edu/academics/humanities-social-sciences/history/isre/symposium/index.html,USCB,Full day of presentations and breakout sessions for the annual symposium.
Ghost Parrots Night,Sports,2026-03-21,2026-03-21,19:00,,,Savannah,"Enmarket Arena, 620 Stiles Avenue, Savannah, GA 31415",https://ghostpirateshockey.com/games/2026/03/21/ghost-parrots-night,Savannah Ghost Pirates,Home Ghost Pirates game against Greenville with the Ghost Parrots Night promotion.
Galactic Bowling,Sports,2026-03-21,2026-03-21,20:00,,,Bluffton,"Station 300 Bluffton, 25 Innovation Drive, Bluffton, SC 29910",https://station300bluffton-temp2.bowlrx.com/specials/galactic-bowling/,Station 300 Bluffton,Saturday night galactic bowling at Station 300.
Healthcare Heroes Appreciation,Sports,2026-03-22,2026-03-22,15:00,,,Savannah,"Enmarket Arena, 620 Stiles Avenue, Savannah, GA 31415",https://ghostpirateshockey.com/games/2026/03/22/healthcare-heroes-appreciation,Savannah Ghost Pirates,Home Ghost Pirates game against Atlanta with a healthcare appreciation promotion.
South Coast Cyber Summit,Education,2026-03-23,2026-03-23,,,,Beaufort County,Beaufort County,https://www.beaufortsc.org/,Visit Beaufort,Regional cybersecurity conference listed by Visit Beaufort.
USCB Interdisciplinary Conference,Education,2026-03-26,2026-03-27,,,,Bluffton,"USCB Bluffton Campus, Bluffton, SC",https://www.uscb.edu/academics/etais/interdisciplinary-conference/index.html,USCB,Interdisciplinary studies conference held virtually and in person.
Chalk It Up!,Culture,2026-03-27,2026-03-29,,,,Beaufort,Beaufort,https://www.beaufortsc.org/,Visit Beaufort,Three-day arts and community festival in Beaufort.
"Finance, Administration, and Economic Development Committee (T)",Civic,2026-05-18,2026-05-18,14:00,14:00,,"Beaufort, SC 29902 County Council Chambers","100 Ribaut Road, Beaufort, SC 29902 County Council Chambers",https://www.beaufortcountysc.gov/events/2026/05/05.18.2026 FAED.html,Beaufort County Calendar,
Public Facilities Committee (T),Civic,2026-05-18,2026-05-18,16:00,16:00,,"Beaufort, SC 29902 County Council Chambers","100 Ribaut Road, Beaufort, SC 29902 County Council Chambers",https://www.beaufortcountysc.gov/events/2026/05/05.18.2026 PFC.html,Beaufort County Calendar,
Councilman York Glover (District 3) to host Community Meeting,Civic,2026-05-18,2026-05-18,17:30,17:30,,"6355 Jonathan Francis Sr. Rd. St. Helena Island, SC 29920","St. Helena Library, 6355 Jonathan Francis Sr. Rd. St. Helena Island, SC 29920",https://www.beaufortcountysc.gov/events/2026/05/05.18.2026 Glover Community Meeting.html,Beaufort County Calendar,
Bluffton Township Fire District Board,Civic,2026-05-19,2026-05-19,16:00,16:00,,"Bluffton, SC 29910","357 Fording Island Road, Bluffton, SC 29910",https://www.beaufortcountysc.gov/events/2026/05/05.19.2026 Bluffton Fire.html,Beaufort County Calendar,
Special Called County Council Meeting (T),Civic,2026-05-19,2026-05-19,16:00,16:00,,"Beaufort, SC","County Council Chambers, 100 Ribaut Road, Beaufort, SC",https://www.beaufortcountysc.gov/events/2026/05/05.19.2026 Special Called County Council Meeting.html,Beaufort County Calendar,
Cultural Protection Overlay District Committee,Civic,2026-05-19,2026-05-19,17:30,17:30,,"6355 Jonathan Francis Sr. Rd. St. Helena Island, SC 29920","St. Helena Library, 6355 Jonathan Francis Sr. Rd. St. Helena Island, SC 29920",https://www.beaufortcountysc.gov/events/2026/05.19.2026.html,Beaufort County Calendar,
Beaufort Memorial Hospital Board of Trustees Combined (FINANCE and BOARD Meeting),Civic,2026-05-20,2026-05-20,07:30,07:30,,"Beaufort, SC","Boardroom, Third Floor, Beaufort Memorial Medical and Administrative Center, 990 Ribaut Road, Beaufort, SC",https://www.beaufortcountysc.gov/events/2026/05/05.20.2026 BMH Combined.html,Beaufort County Calendar,
Birding at White Hall: Land Preservation Nature Program,Civic,2026-05-20,2026-05-20,08:00,09:30,,"Beaufort, SC","Whitehall Park, 120 White Hall Drive, Beaufort, SC",https://www.beaufortcountysc.gov/events/2026/05/05.20.2026 Birding at WH.html,Beaufort County Calendar,
Beaufort County Transportation Committee (T),Civic,2026-05-20,2026-05-20,16:00,16:00,,"Beaufort, SC 29902 County Council Chambers","100 Ribaut Road, Beaufort, SC 29902 County Council Chambers",https://www.beaufortcountysc.gov/events/2026/05/05.20.2026 CTC.html,Beaufort County Calendar,
Estuary Exploration at Widgeon Point: Land Preservation Program,Civic,2026-05-21,2026-05-21,08:30,10:00,,"Beaufort, SC","Widgeon Point Preserve, 43 Okatie Hwy, Beaufort, SC",https://www.beaufortcountysc.gov/events/2026/05/05.21.2026 Estuary Exploration at WP.html,Beaufort County Calendar,
Beaufort-Jasper Water and Sewer Authority Board,Civic,2026-05-21,2026-05-21,09:00,09:00,,"Okatie, SC","Executive Board Room, 109B, Administration Building, 6 Snake Road, Okatie, SC",https://www.beaufortcountysc.gov/events/2026/05/05.21.2026 BJWSA.html,Beaufort County Calendar,
Beaufort County Economic Development Corporation,Civic,2026-05-21,2026-05-21,14:00,14:00,,"97 Progressive Street, Bluffton - The Cove","97 Progressive Street, Bluffton - The Cove",https://www.beaufortcountysc.gov/events/2026/05/05.21.2026 BCEDC.html,Beaufort County Calendar,
Chat with Council,Civic,2026-05-21,2026-05-21,18:00,18:00,,"Bluffton, SC 29910","Bluffton Public Library, 120 Palmetto Way, Bluffton, SC 29910",https://www.beaufortcountysc.gov/events/2026/05/05.21.2025 Chat with Council .html,Beaufort County Calendar,
Northern Beaufort County Regional Plan Implementation Committee (T),Civic,2026-05-22,2026-05-22,09:00,09:00,,"Beaufort, SC","Executive Conference Room, Administration Building, Beaufort County Government Robert Smalls Complex, 100 Ribaut Road, Beaufort, SC",https://www.beaufortcountysc.gov/events/2026/05/05.22.2026 NRPIC.html,Beaufort County Calendar,
County Offices Closed,Civic,2026-05-25,2026-05-25,00:00,00:00,,"Beaufort County, SC",,https://www.beaufortcountysc.gov/events/2026/05/05.25.2026 Memorial Day.html,Beaufort County Calendar,
Veterans Affairs Memorial Day Parade,Civic,2026-05-25,2026-05-25,10:00,10:00,,"Beaufort, SC 29902","1601 Boundary Street, Beaufort, SC 29902",https://www.beaufortcountysc.gov/events/2026/05/05.25.2026 Veterans Affairs Memorial Day Parade.html,Beaufort County Calendar,
Southern Lowcountry Regional Board (T),Civic,2026-05-26,2026-05-26,10:00,10:00,,"Bluffton, SC - Rotary Community Center","11 Recreation Court, Bluffton, SC - Rotary Community Center",https://www.beaufortcountysc.gov/events/2026/05/05.26.2026 SOLOCO.html,Beaufort County Calendar,
Caucus (T),Civic,2026-05-26,2026-05-26,16:00,16:00,,"Beaufort, SC 29902 County Council Chambers","100 Ribaut Road, Beaufort, SC 29902 County Council Chambers",https://www.beaufortcountysc.gov/events/2026/05/05.26.2026 Caucus.html,Beaufort County Calendar,
County Council Regular Session (T),Civic,2026-05-26,2026-05-26,18:00,18:00,,"Beaufort, SC 29902 County Council Chambers","100 Ribaut Road, Beaufort, SC 29902 County Council Chambers",https://www.beaufortcountysc.gov/events/2026/05/05.26.2026 Council .html,Beaufort County Calendar,
Birding at Widgeon Point: Land Preservation Nature Program,Civic,2026-05-27,2026-05-27,08:00,09:30,,"Beaufort, SC","Widgeon Point Preserve, 43 Okatie Hwy, Beaufort, SC",https://www.beaufortcountysc.gov/events/2026/05/05.27.2026 Birding at WP.html,Beaufort County Calendar,
Burton Fire District Commission,Civic,2026-05-27,2026-05-27,12:00,12:00,,"14 Bruce K Smalls Road, Beaufort","14 Bruce K Smalls Road, Beaufort",https://www.beaufortcountysc.gov/events/2026/05/05.27.2026 Burton Fire.html,Beaufort County Calendar,
Lowcountry Regional Transportation Authority Board,Civic,2026-05-27,2026-05-27,14:00,14:00,,"25 Benton Field Road, Bluffton SC 29910 -Palmetto Breeze Facility","25 Benton Field Road, Bluffton SC 29910 -Palmetto Breeze Facility",https://www.beaufortcountysc.gov/events/2026/05/05.27.2026 LRTA.html,Beaufort County Calendar,
Special Called Executive Committee Meeting (T),Civic,2026-05-28,2026-05-28,13:00,13:00,,"Beaufort, SC","County Council Chambers, 100 Ribaut Road, Beaufort, SC",https://www.beaufortcountysc.gov/events/2026/05/05.28.2026 SC Executive Committee.html,Beaufort County Calendar,
Solid Waste and Recycling Board (T),Civic,2026-05-28,2026-05-28,14:00,14:00,,"Beaufort, SC 29902 County Council Chambers","100 Ribaut Road, Beaufort, SC 29902 County Council Chambers",https://www.beaufortcountysc.gov/events/2026/05/05.25.2026 SWR Board.html,Beaufort County Calendar,
Zoning Board of Appeals (T),Civic,2026-05-28,2026-05-28,17:00,17:00,,"Beaufort, SC 29902 County Council Chambers","100 Ribaut Road, Beaufort, SC 29902 County Council Chambers",https://www.beaufortcountysc.gov/events/2026/05/05.28.2026 ZBOA.html,Beaufort County Calendar,
Cast Net Clinic at Brewer: Land Preservation Program,Civic,2026-05-30,2026-05-30,11:00,12:00,,"Beaufort, SC","Brewer Memorial Park, 47 Sea Island Pkwy, Beaufort, SC",https://www.beaufortcountysc.gov/events/2026/05/05.30.2026 Cast Net Clinic at Brewer.html,Beaufort County Calendar,
Special Called County Council Meeting (T),Civic,2026-06-01,2026-06-01,15:00,15:00,,"Beaufort, SC","County Council Chambers, 100 Ribaut Road, Beaufort, SC",https://www.beaufortcountysc.gov/events/2026/06/06.01.2026 SC Council Meeting.html,Beaufort County Calendar,
Acoustic Muffin Duo,Live Music,2026-06-01,2026-06-01,18:00,21:00,,"SC, United States","Charleston Pour House – Deck Stage, 1977 Maybank Hwy, Charleston, SC, United States",https://charlestonpourhouse.com/event/acoustic-muffin-duo-2026-05-18/2026-06-01/,Charleston Pour House,"Acoustic Muffin Duo w/ Special Guests Mondays: May 18th, June 1st, June 8th, July 6th Charleston Pour House | Deck Stage 5pm doors / 630pm shows FREE SHOWS 2 x sets Acoustic Muffin (Dangermuffin) Dangermuffin are storytellers. Casting images that are timeless yet novel, the band blends mindful lyrics with contemplative sounds, creating songs aimed at reinvigorating the soul. Having played festival stages and concert halls across the US and beyond, this seasoned outfit continues to share its music through live shows as well as online, where their streaming numbers have recently garnered exponential growth. The band’s far-reaching catalog is ripe with engaging, singable tracks that ask to be played on repeat."
Planning Commission (T),Civic,2026-06-01,2026-06-01,18:00,18:00,,"Beaufort, SC 29902 County Council Chambers","100 Ribaut Road, Beaufort, SC 29902 County Council Chambers",https://www.beaufortcountysc.gov/events/2026/06/06.01.2026 Planning .html,Beaufort County Calendar,
Bodhi Grease,Live Music,2026-06-02,2026-06-02,18:00,21:00,,"SC, United States","Charleston Pour House – Deck Stage, 1977 Maybank Hwy, Charleston, SC, United States",https://charlestonpourhouse.com/event/jim-rubush-friends-2/2026-06-02/,Charleston Pour House,"Bodhi Grease feat. Jim Rubush, Ben Mossman & Jager Soss Tuesdays, June 2nd, 13th, 20th Charleston Pour House | Deck Stage $10 @ the door 5pm doors /6pm show 2 x sets Bodhi Grease Ft. Jim Rubush, Ben Mossman & Sagger Soss"
Glenn Miller Orchestra,Live Music,2026-06-02,2026-06-02,19:00,,,"Charleston, SC","37 John Street, Charleston, SC 29403",https://charlestonmusichall.com/event/glenn-miller-orchestra/,Charleston Music Hall,Doors: 6:00 pm | Show: 7:00 pm | Tickets: https://www.ticketmaster.com/glenn-miller-orchestra-charleston-south-carolina-06-02-2026/event/2D0064439C697E3F
Birding at Crystal Lake: Land Preservation Nature Program,Civic,2026-06-03,2026-06-03,08:00,09:30,,"Beaufort, SC","Crystal Lake Park, 124 Lady's Island Drive, Beaufort, SC",https://www.beaufortcountysc.gov/events/2026/06/06.03.2026 Birding at CL.html,Beaufort County Calendar,
The Reckoning,Live Music,2026-06-03,2026-06-03,18:30,21:30,,"SC, United States","Charleston Pour House – Deck Stage, 1977 Maybank Hwy, Charleston, SC, United States",https://charlestonpourhouse.com/event/the-reckoning-5-2024-08-07/2026-06-03/,Charleston Pour House,The Reckoning Every Wednesday 5pm Doors/6:30pm Show 2 Sets of Grateful Dead $10 at the door. * Show is 21+. Attendees under the age of 21 must be accompanied by a parent or guardian. Attendees under 21 will be subject to a $5 surcharge. The surcharge must be paid in cash at the door on the day of the event.
Design Review Board,Civic,2026-06-04,2026-06-04,14:30,14:30,,"Okatie SC 29909, Grace Coastal Church","15 Williams Drive, Okatie SC 29909, Grace Coastal Church",https://www.beaufortcountysc.gov/events/2026/06/06.04.2026 Design .html,Beaufort County Calendar,
Lee Ross,Live Music,2026-06-04,2026-06-04,18:00,21:00,,"SC, United States","Charleston Pour House – Deck Stage, 1977 Maybank Hwy, Charleston, SC, United States",https://charlestonpourhouse.com/event/lee-ross/,Charleston Pour House,"Lee Ross Thursday June 4th, 2026 Charleston Pour House | Deck Stage 5:00pm Doors / 6:00pm Show 2 x sets $10 Advance / $10 Day of Show Lee Ross Lee Ross is a one man party band from Massachusetts. He has played shows all over the eastern US and eastern Canada. Using saxophone, keyboards, and flute he live-loops all sorts of funky sounds and grooves to create a wild musical experience. It’s a dance party for everyone’s universe! In addition to solo shows, he has played saxophone on stage with a variety of artists including George Clinton, Guster, State Radio, G. Love & Special Sauce, Twiddle, Lespecial, Pigeons Playing Ping Pong, Neighbor, and many others. * By purchasing a ticket, you agree to receive emails from ARTIST and PROMOTER. * Show is for all ages. Attendees under 18 must be accompanied by a parent. Attendees under 21 will be subject to a $5 surcharge. The surcharge must be paid in cash at the door on the day of the event."
Rumours ATL: A Fleetwood Mac Tribute on the NÜTRL Beach Stage – Thursday,Live Music,2026-06-04,2026-06-04,18:00,,,"Isle of Palms, SC","1008 Ocean Boulevard, Isle of Palms, SC 29451",https://the-windjammer.com/event/rumours-thu/,The Windjammer,"6:00 pm | Artist Website https://www.rumoursatl.com For over a decade, Rumours ATL has proven to be the most authentic live recreation of Fleetwood Mac’s golden era. With a reverence for the legendary group’s rich history, Rumours ATL masterfully captures the magic of Fleetwood Mac’s iconic sound. From the hauntingly beautiful melodies of “Rhiannon” and “Songbird” to the electrifying [&hellip;] | Tickets: https://whollyticket.com/e/Rumours26thu"
Frute,Live Music,2026-06-05,2026-06-05,18:00,21:00,,"SC, United States","Charleston Pour House – Deck Stage, 1977 Maybank Hwy, Charleston, SC, United States",https://charlestonpourhouse.com/event/frute-4/,Charleston Pour House,"Frute Friday, June 5th 2026 Charleston Pour House | Deck Stage 5pm doors / 6pm show $10 Advance / $12 Day of Show Frute Six-piece indie/jam band from Atlanta, GA *By purchasing a ticket, you agree to receive emails from ARTIST and PROMOTER. * Show is 18+. Attendees under the age of 18 must be accompanied by a parent or guardian. Attendees under 21 will be subject to a $5 surcharge. The surcharge must be paid in cash at the door on the day of the event."
Rumours ATL: A Fleetwood Mac Tribute on the NÜTRL Beach Stage – Friday,Live Music,2026-06-05,2026-06-05,18:00,,,"Isle of Palms, SC","1008 Ocean Boulevard, Isle of Palms, SC 29451",https://the-windjammer.com/event/rumours-fri/,The Windjammer,"6:00 pm | Artist Website https://www.rumoursatl.com For over a decade, Rumours ATL has proven to be the most authentic live recreation of Fleetwood Mac’s golden era. With a reverence for the legendary group’s rich history, Rumours ATL masterfully captures the magic of Fleetwood Mac’s iconic sound. From the hauntingly beautiful melodies of “Rhiannon” and “Songbird” to the electrifying [&hellip;] | Tickets: https://whollyticket.com/e/Rumours26fri"
Croce & Carole: The Life & Music of Jim Croce & Carole King,Live Music,2026-06-05,2026-06-05,20:00,,,"Charleston, SC","37 John Street, Charleston, SC 29403",https://charlestonmusichall.com/event/croce-carole-the-life-music-of-jim-croce-carole-king/,Charleston Music Hall,Doors: 7:00 pm | Show: 8:00 pm | Tickets: https://www.ticketmaster.com/croce-carole-the-life-music-of-charleston-south-carolina-06-05-2026/event/2D006488A1B8EAEF
Medusa’s Mayhem,Live Music,2026-06-05,2026-06-05,20:00,,,"Charleston, SC","32 Ann Street, Charleston, SC 29403",https://musicfarm.com/event/medusas-mayhem/,Music Farm,Doors: 7:00 pm | Show: 8:00 pm
An Evening with Patterson Hood,Live Music,2026-06-05,2026-06-06,21:00,00:00,,"29412, United States","Charleston Pour House – Main Stage, 1977 Maybank Hwy., Charleston Pour House, SC, 29412, United States",https://charlestonpourhouse.com/event/an-evening-with-patterson-hood/,Charleston Pour House,"An Evening With Patterson Hood of Drive-By Truckers Friday, June 5th 2026 Charleston Pour House | Main Stage 8pm doors /9pm show Ticket Prices: – Seated: $35 Advance *Limited amount available* – Standing: $30 Advance / $35 Day of show Patterson Hood (of Drive-By Truckers) Drive-By Truckers co-founder Patterson Hood’s fourth solo album and first in over 12 years, Exploding Trees & Airplane Screams sees the veteran singer, guitarist, and songwriter exploring his youth and young manhood in a collection unlike anything in his ever-evolving catalogue. A baroque American song cycle spanning the time between early childhood and leaving his rural hometown in search of his musical dreams, the album gathers songs that have amassed over the remarkably prolific songwriter’s career, many of which provided him with distraction and creative sustenance during lockdown, others which have resided among his notebooks for years. “This record has all these kinds of unintended themes,” Hood says. “It’s all subconscious, because I didn’t really set out with an agenda, writing-wise. It really just kind of occurred to me when I was actually putting it all together, just how much it seems to have a theme to it.” The dozen years since his last extracurricular outing, 2012’s Heat Lightning Rumbles in the Distance, had seen Hood accumulate a cache of material which did not quite fit into the Drive-By Truckers canon, songs which he set aside for “if and when” he got around to another solo project. Kept off the road during the 2020 lockdown, he found himself recording demos in his Portland, OR attic, without a clear plan but thinking “maybe this might be worth pursuing at some point.” Hood had moved to Portland with his family in 2013 and swiftly found a place among the Rose City’s thriving music scene, including a friendship forged with producer/musician Chris Funk (The Decemberists). Having long discussed collaborating, in 2023 the two artists’ typically stacked calendars finally allowed them the opportunity to team up and they set to work recording what Hood intended to be “a bigger departure” from Drive-By Truckers and his previous solo efforts than ever before. “The band has been in such a good place that I hadn’t really thought in terms of doing anything outside of the Truckers anytime soon,” Hood says. “I decided if I ever was going to do another solo record, I wanted it to be pretty different than the band, as different as it can be.” Working largely at a number of Portland studios, Hood accomplished his goal, in part by writing much of the album on piano in a vigorous attempt to expand his parameters in new, heretofore uncharted, directions. While he planned to bring in a professional pianist for the recording sessions, Funk, eager to push his friend from his comfort zone, encouraged Hood to play the parts himself. Hood further took the occasion to explore sounds outside the boundaries and obligations of his day job, deviating from Drive-By Truckers’ traditionally guitar-driven palette to craft richly textured arrangements marked by the inclusion of strings, woodwinds, and vintage analog synthesizers. “There’s really not a lot of guitar work on this album,” he says. “I’m only playing electric on a few things. That was fun too, because, I’m in a really kickass guitar band so it’s great to do something outside of that. Everything ultimately suited the project. It’s not like these decisions were made just for the sake of it. There was a point to it, for sure.” Auxiliary backing was provided by a stellar cast of friends and musicians including fellow Alabama native Katie Crutchfield (Waxahatchee), Brad and Phil Cook (Megafaun), Kevin Morby, Wednesday, Steve Berlin (Los Lobos, The Blasters), Brad Morgan and Jay Gonzalez (Drive-By Truckers), David Barbe (Sugar, Mercyland), Nate Query (The Decemberists), Steve Drizos (Jerry Joseph and The Jackmormons), Daniel Hunt (Neko Case, M Ward), and Stuart Bogie (The Hold Steady, Goose). But as Hood says, “Everything was built around the songs.” To some extent, he notes, the album moves backwards in time, with “The Exploding Trees” being the most contemporary event in the timeline of the record, inspired in part by Hood’s own short story chronicling a natural disaster that occurred in his North Alabama hometown just as he turned 30 and relocated to Athens, GA where Drive-By Truckers were co-founded in 1996. With its powerful textural clarity and Hood’s literary strengths at the fore, Exploding Trees & Airplane Screams emerges as a staggering investigation into how time can shed light on the recesses of memory, revealing this exceptionally gifted songwriter’s resolute inclination to look back through the golden haze to grapple with the darkness and secret truths that perhaps weren’t understood or reckoned with at the time. As he has throughout his career – from Drive-By Truckers’ ceaseless investigation into American values and culture to his solo body of work’s autobiographical meditations – Exploding Trees and Airplane Screams sees Patterson Hood once again stripping away the facade of things to get to the core, lifting up life’s rock to see what lies underneath. “You remember things one way,” he says, “but when you really dip into it, when you really look back, the world was a different place. Things were accepted that wouldn’t be accepted now and things you didn’t understand then make sense now. “I don’t know if there was anything I set out to do on this record as much as it just kind of worked out that way. You know, there are a lot a lot of happy accidents in this record.” *By purchasing a ticket, you agree to receive emails from ARTIST and PROMOTER. * Show is 21+. Attendees under the age of 21 must be accompanied by a parent or guardian. Attendees under 21 will be subject to a $5 surcharge. The surcharge must be paid in cash at the door on the day of the event."
VYNL on the inside Stage,Live Music,2026-06-05,2026-06-05,21:45,,,"Isle of Palms, SC","1008 Ocean Boulevard, Isle of Palms, SC 29451",https://the-windjammer.com/event/vynl-4/,The Windjammer,9:45 pm | Artist Website https://www.instagram.com/vynl_chs/ | Tickets: https://whollyticket.com/e/VYKLjune26
