Name,Type,Location,Address,Latitude,Longitude,Phone,Website,Email,Notes
USCB Center for the Arts,Performing Arts Center,"Beaufort, SC","805 Carteret Street, Beaufort, SC 29902",,,843-521-4145,https://www.uscbcenterforthearts.com/,,Downtown performing arts venue presenting touring artists, theater, and live concerts.
Shellring Ale Works,Brewery Music Venue,"Port Royal, SC","1111 11th Street, Port Royal, SC 29935",,,843-379-2370,https://shellringaleworks.com,taproom@shellringaleworks.com,Riverfront brewery with a beer garden that regularly hosts live music.
Fishcamp on 11th Street,Waterfront Music Venue,"Port Royal, SC","1699 11th Street, Port Royal, SC 29935",,,843-379-2248,https://fishcampon11th.com,,"Waterfront restaurant and bar with seasonal live music near the docks."
The Fillin' Station,Live Music Bar,"Beaufort, SC","57 Sea Island Parkway, Beaufort, SC 29907",,,843-522-0230,https://thefillinstationbft.com,info@thefillinstationbft.com,Local dive bar with regular live music, food, and marsh views.
Port Royal Street Music,Outdoor Concert Series,"Port Royal, SC","Paris Avenue between 9th and 10th Streets, Port Royal, SC 29935",,,,,Free recurring street concert series that brings touring and local acts to Port Royal.
Victory North,Live Music Venue,"Savannah, GA","2603 Whitaker Street, Savannah, GA 31401",,,,912-323-2616,https://www.victorynorthsavannah.com/contact,info@victorynorthsavannah.com,Starland District venue hosting touring acts tribute nights and jazz-forward concert events in a restored ice factory space.
District Live,Live Music Venue,"Savannah, GA","400 W River Street, Savannah, GA 31401",,,,912-373-9100,https://www.plantriverside.com/event/vincent-neil-emerson/,VIPServices@jwsavannah.com,Plant Riverside concert room presenting ticketed live music with a riverfront setting and a mix of local regional and touring acts.
Tybee Post Theater,Performing Arts Center,"Tybee Island, GA","10 Van Horne Avenue, Tybee Island, GA 31328",,,,912-472-4790,https://www.tybeeposttheater.org/,info@tybeeposttheater.org,Historic Tybee theater offering live music almost every weekend along with films comedy and community performances.
The Wormhole,Live Music Bar,"Savannah, GA","2307 Bull Street, Savannah, GA 31401",,,,912-777-5720,https://wormholebar.com/,WormholeBar@gmail.com,Starland dive bar and neighborhood music room known for eclectic concerts open mics comedy and late-night hangs.
Charleston Music Hall,Performing Arts Center,"Charleston, SC","37 John Street, Charleston, SC 29403",,,,843-853-2252,https://www.charlestonmusichall.com/,info@charlestonmusichall.com,Historic downtown listening room and performance hall hosting concerts comedy and arts programming with strong touring talent.
Music Farm,Live Music Venue,"Charleston, SC","32 Ann Street, Charleston, SC 29403",,,,843-853-2252,https://musicfarm.com/,info@musicfarm.com,Downtown Charleston concert venue booking indie rock dance nights tribute shows and nationally touring acts.
Charleston Pour House,Live Music Venue,"Charleston, SC","1977 Maybank Highway, Charleston, SC 29412",,,,,https://charlestonpourhouse.com/shows/,anna@charlestonpourhouse.com,James Island venue with indoor and deck stages and live music seven days a week spanning local bands and touring acts.
The Windjammer,Waterfront Music Venue,"Isle of Palms, SC","1008 Ocean Boulevard, Isle of Palms, SC 29451",,,,843-886-8596,https://the-windjammer.com/,Mgt@windjammeriop.com,Long-running beach club and open-air concert venue on Front Beach with local bands national acts and ocean views.
